"","linesRemove","Freq","ind","city","class"
"265139","mr thompson it could be adopted today",1,265139,"Louisiana_Shreveport",NA
"330450","read by title and as read motion by councilman gibson seconded by councilman lester passed by the",1,330450,"Louisiana_Shreveport",NA
"433343","under construction approximate remaining funds are",1,433343,"Louisiana_Shreveport",NA
"292632","on the affirmative okay okay",1,292632,"Louisiana_Shreveport",NA
"202748","in addition the program also provides a rebate of state sales use tax on materials for building materials machinery and equipment purchased during the construction period and used exclusively on site participation in this program excludes the use of the enterprise zone program call for more information",1,202748,"Louisiana_Shreveport",NA
"256536","mr barrett to be voted on whether to postpone",1,256536,"Louisiana_Shreveport",NA
"27675","and trying to contribute to the civic world being of this community that we would not continue to",1,27675,"Louisiana_Shreveport",NA
"123448","councilman walford inaudible right",1,123448,"Louisiana_Shreveport",NA
"187948","has experienced increasing cost to provide health insurance to employees",1,187948,"Louisiana_Shreveport",NA
"93581","contractor shall comply with the fair share",1,93581,"Louisiana_Shreveport",NA
"393699","the city of shreveport is on firm financial ground as it prepares to market more than",1,393699,"Louisiana_Shreveport",NA
"72352","carried ah just kinda pointing over here somebody with you but i think the",1,72352,"Louisiana_Shreveport",NA
"380206","surrender of the bonds to the paying agent",1,380206,"Louisiana_Shreveport",NA
"258777","mr enochs absolutely and i think that applies to many industries but that applies to car factories",1,258777,"Louisiana_Shreveport",NA
"313431","please read these application guidelines carefully incomplete or late",1,313431,"Louisiana_Shreveport",NA
"81254","claim settlement procedures the litigation management system that tracks assignment",1,81254,"Louisiana_Shreveport",NA
"299582","or therein that causes or cause a minor child of ordinary curiosity to desire to examine such",1,299582,"Louisiana_Shreveport",NA
"147587","donation of the property to shreveport bossier community renewal inc and to",5,147587,"Louisiana_Shreveport",NA
"342881","responds and a problem you think the key holder should have to go the police",1,342881,"Louisiana_Shreveport",NA
"188790","have a responsibility as a council when that administration comes up short and whenever they",1,188790,"Louisiana_Shreveport",NA
"458726","which from a pr standpoint not be a very good thing for those of us on the",1,458726,"Louisiana_Shreveport",NA
"457799","whereby the city handles it you still end up going to the mineral board and that is requires by",1,457799,"Louisiana_Shreveport",NA
"343894","retired in the morning we could only pay of the retirement obligation that we have",1,343894,"Louisiana_Shreveport",NA
"121722","councilman stewart i believe that we do mr thompson can you respond please mr thompson i",1,121722,"Louisiana_Shreveport",NA
"104956","councilman green ms godfrey before you go i would just like to say",1,104956,"Louisiana_Shreveport",NA
"280643","now therefore be it ordained by the city council of the city",1,280643,"Louisiana_Shreveport",NA
"126597","councilman webb and i agree with that ms avery and why when i said",1,126597,"Louisiana_Shreveport",NA
"251314","more wrecks with the traffic well if both of those things are going to be harmed there is no way that the",1,251314,"Louisiana_Shreveport",NA
"371615","staff contributed significantly to improvements to the original plan for which we were all very",1,371615,"Louisiana_Shreveport",NA
"79530","city court the city court does not have a policy for custodial credit risk as of of",1,79530,"Louisiana_Shreveport",NA
"191369","heard anything as it relates to that and i know capital outlay is like throwing money in the air and",1,191369,"Louisiana_Shreveport",NA
"223158","kentucky av fredrick lakeshore",1,223158,"Louisiana_Shreveport",NA
"410802","the stips ms bowman as i gave you i did not know and not sure whether he knew which he",1,410802,"Louisiana_Shreveport",NA
"438058","various facilities owned by the issuer the project and will result in guaranteed energy",1,438058,"Louisiana_Shreveport",NA
"417364","this point mr chairman and members of council like to ask police chief henry",1,417364,"Louisiana_Shreveport",NA
"319034","problems downtown downtown is an area that made a tremendous investment on",1,319034,"Louisiana_Shreveport",NA
"449630","we want you all to change this law that we want you all to change today well we still have that",1,449630,"Louisiana_Shreveport",NA
"244387","mayor of this city the emails that exchanged the work that put forth over",1,244387,"Louisiana_Shreveport",NA
"272814","nays none absent councilman carmody council considered ordinance no of",1,272814,"Louisiana_Shreveport",NA
"159155","e street thence run easterly along e street to its intersection with e kings hwy thence",1,159155,"Louisiana_Shreveport",NA
"164357","fairfield property management because the other side of the story is just to the south i guess",1,164357,"Louisiana_Shreveport",NA
"9476","again we are taking a look at businesses and residents that are on the water system that have",1,9476,"Louisiana_Shreveport",NA
"237934","make an intelligent decision as far as what our budget actually reflects what the administration can",1,237934,"Louisiana_Shreveport",NA
"412182","the weed abatement process is cumbersome by nature and difficult to control",1,412182,"Louisiana_Shreveport",NA
"2982","accountants lawyers for example a lawyer so lawyers have an opportunity producers inaudible hair",1,2982,"Louisiana_Shreveport",NA
"34098","appointee head of personnel department holding a position then you have mr mattox",1,34098,"Louisiana_Shreveport",NA
"77705","chief training officer to attend the fdic conference in indianapolis as well as sending an assistant chief",1,77705,"Louisiana_Shreveport",NA
"364523","situations happen have there been any occurrences in the past i know i heard of one",1,364523,"Louisiana_Shreveport",NA
"347889","run the numbers and do the financial projections based on the tif he is the financial guy in",1,347889,"Louisiana_Shreveport",NA
"459890","wholeheartedly support the pay raise for the city employees one of the things that i believe is",1,459890,"Louisiana_Shreveport",NA
"220734","jan thru dec",2,220734,"Louisiana_Shreveport",NA
"35199","approval of the contents of the proposed notice of intention and other matters in connection therewith",1,35199,"Louisiana_Shreveport",NA
"307018","pastor baker well i go by p o box shreveport la and i do pastor in",1,307018,"Louisiana_Shreveport",NA
"358962","shotgun house and i think kelvin has made the fire department here in the city of",1,358962,"Louisiana_Shreveport",NA
"64878","building permit expired but most of these receipts that given us for materials were at least three",1,64878,"Louisiana_Shreveport",NA
"187661","has also decreased while sales tax revenue should hold steady the increased growth as seen in",1,187661,"Louisiana_Shreveport",NA
"106462","councilman hogan if there are no objections from any councilmen going to",1,106462,"Louisiana_Shreveport",NA
"27426","and to develop the neighborhood revitalization expertise required to address the slum and",1,27426,"Louisiana_Shreveport",NA
"187333","happen to be located in district f we are extremely proud of you all because you all are",1,187333,"Louisiana_Shreveport",NA
"30724","answer the phones and assist with equipment issue and inventory without having to hold an officer over after",1,30724,"Louisiana_Shreveport",NA
"106887","councilman hogan mr jackson you have a",1,106887,"Louisiana_Shreveport",NA
"25850","and substitute with the attached amendment to cooperative endeavor",1,25850,"Louisiana_Shreveport",NA
"317168","presented their budget to us there were unfunded items and a shortage of officers and yet got to spend the",1,317168,"Louisiana_Shreveport",NA
"140887","detached building at santa monica has a storefront facade a bathroom within and",1,140887,"Louisiana_Shreveport",NA
"47660","automobile laundry",2,47660,"Louisiana_Shreveport",NA
"34024","apply in this context directly as suggesting this is not apples to apples an abo card",1,34024,"Louisiana_Shreveport",NA
"416608","this is hicks electric this is our neighbor on the other side of us right here this is annie",1,416608,"Louisiana_Shreveport",NA
"356895","set forth to be performed by and on behalf of the city shall be for the benefit protection and",1,356895,"Louisiana_Shreveport",NA
"386401","that in a sinking fund so to speak to repay this debt off correct",1,386401,"Louisiana_Shreveport",NA
"464728","women who get good information from the staff and they make sound decisions",1,464728,"Louisiana_Shreveport",NA
"49021","backflow preventers water distribution",8,49021,"Louisiana_Shreveport",NA
"46865","authorizing the donation of shreveport police department",1,46865,"Louisiana_Shreveport",NA
"377988","successor owners shall defend indemnify and hold harmless the city of shreveport from any",1,377988,"Louisiana_Shreveport",NA
"3220092","shadow length of the building in question the longest shadow that any building will cast during the year occurs on de",6,3220092,"New York_New York City",NA
"38703","a copy of the notice shall also be served by personal delivery to the tenant cooperator or by",1,38703,"New York_New York City",NA
"3197479","septimo piso de avenue d",1,3197479,"New York_New York City",NA
"2993598","regarding the appropriate financing of nycers and takes into",1,2993598,"New York_New York City",NA
"2586215","one risk behavior and patients not recall or reveal all risk behaviors",1,2586215,"New York_New York City",NA
"1973775","j n aviles department of parks recr u",1,1973775,"New York_New York City",NA
"642876","can i take the nysdot examination anywhere in new york state",2,642876,"New York_New York City",NA
"33719","achieve any of the following",1,33719,"New York_New York City",NA
"1856998","instructions please read the instructions for further details before completing this form please print all",1,1856998,"New York_New York City",NA
"2020490","kingsbridge jerome park two family dwellings orloff avenue",1,2020490,"New York_New York City",NA
"1598959","have private or semi private client rooms outreach teams are the sole referral source for these programs the",1,1598959,"New York_New York City",NA
"1907100","is the baby receiving immunizations",1,1907100,"New York_New York City",NA
"2927466","quality is improved and probably more reflective of jamaica bay a fish survey of the basin",1,2927466,"New York_New York City",NA
"226973","amount of expenditures for the taxable year provided entire net income is computed without",1,226973,"New York_New York City",NA
"1456113","from a variety of locations in new york city beginning at and will",1,1456113,"New York_New York City",NA
"3294929","s o phillip department of transportati a",2,3294929,"New York_New York City",NA
"3429943","systems interior layout spatial design",1,3429943,"New York_New York City",NA
"975779","definition the warrants and designated crimes for which a new york city public housing",2,975779,"New York_New York City",NA
"1452841","from a borough wide program and",1,1452841,"New York_New York City",NA
"3516854","the city is committed to ensuring that the escr project addresses the need for continued social",1,3516854,"New York_New York City",NA
"3504040","theatre subdistrict through block gallerias",1,3504040,"New York_New York City",NA
"1214423","e mcleod transit authority",2,1214423,"New York_New York City",NA
"603520","buildings this rezoning is unlikely to induce any new development on this site",1,603520,"New York_New York City",NA
"2889342","provide debrief report prior to deactivation or release",1,2889342,"New York_New York City",NA
"426046","a to track with some accu",1,426046,"New York_New York City",NA
"138427","agent nash co lp information dare to dream housing association inc",2,138427,"New York_New York City",NA
"4101779","zoning resolution that is put into effect does not remain co nst ant",1,4101779,"New York_New York City",NA
"143134","agent opm group llc informat hmp enterprises llc",1,143134,"New York_New York City",NA
"1388833","floodproofing commercial corridors non conforming homes in m districts",1,1388833,"New York_New York City",NA
"3755623","total costs provided on your cpa certification of costs and should agree with the development",1,3755623,"New York_New York City",NA
"2533269","of ec molecular wt of carbon tetrachloride",1,2533269,"New York_New York City",NA
"1174978","educational signs",1,1174978,"New York_New York City",NA
"3028080","requested any illegible information also create the need for a new sample",1,3028080,"New York_New York City",NA
"3423139","sutter avenue union street sutter avenue union street reid apartments brooklyn",1,3423139,"New York_New York City",NA
"1289835","evaluated for the weekday midday peak hour time period at one pedestrian element",1,1289835,"New York_New York City",NA
"2021599","k isaac department of parks recr u",1,2021599,"New York_New York City",NA
"2862170","projected development",11,2862170,"New York_New York City",NA
"2632697","or streets on each side of the site as well a small",1,2632697,"New York_New York City",NA
"2642795","other mosquito borne diseases",1,2642795,"New York_New York City",NA
"4013315","with its high share of underbanked households followed by brooklyn see table queens has a",1,4013315,"New York_New York City",NA
"1702161","identify patients",1,1702161,"New York_New York City",NA
"490062","be accessed online and printed from here",1,490062,"New York_New York City",NA
"2158935","lt w",2,2158935,"New York_New York City",NA
"923748","curriculum staffing structure",1,923748,"New York_New York City",NA
"1996334","jurisdiction or proof is submitted of a judgment order or decree relating to the adoption of the",2,1996334,"New York_New York City",NA
"1519437","g cherry district attorney kings co a",2,1519437,"New York_New York City",NA
"4035868","work through blogs videos event activations",1,4035868,"New York_New York City",NA
"1593740","hasta por si termina satisfactoriamente el programa en cada caso la ocse",1,1593740,"New York_New York City",NA
"940867","data on the number and kind of taxpayers carrying forward tax benefits to future years and",1,940867,"New York_New York City",NA
"2558138","of the building constructed between and it is possible that these materials",1,2558138,"New York_New York City",NA
"560389","both breastfeeding and contraception offer multiple health benefits to mothers babies and their families",1,560389,"New York_New York City",NA
"3970686","whereas doitt as lead agency pursuant to section e of title of the",7,3970686,"New York_New York City",NA
"2113956","li renmen jwe moun epi li ta ka kriye la sispann pitit ou si pitit ou",2,2113956,"New York_New York City",NA
"669273","ccns jamaica avenue quinto piso jamaica ny",3,669273,"New York_New York City",NA
"2552408","of public and private under multiple ownership existing",1,2552408,"New York_New York City",NA
"4046547","w santiago transit authority",19,4046547,"New York_New York City",NA
"2744767","pertaining to street widths traffic flow directions lane markings parking regulations and bus",1,2744767,"New York_New York City",NA
"1719311","if yes please list full names and addresses of all salespersons or route persons representing you",2,1719311,"New York_New York City",NA
"1327070","facilitar el proceso de y al ayudar a los negocios a entender sanciones y proveer formas convenientes de resolver infracciones",1,1327070,"New York_New York City",NA
"3428046","syringe exchange and methadone treatment programs we estimate that over overdose reversals",1,3428046,"New York_New York City",NA
"590253","b site visits",2,590253,"New York_New York City",NA
"791353","common questions regarding service",1,791353,"New York_New York City",NA
"3680383","this procedure is being re issued to give guidance on foster care re entry to both foster",1,3680383,"New York_New York City",NA
"1264580","ere",7,1264580,"New York_New York City",NA
"1491053","from the facility to the nearest form of transport building",1,1491053,"New York_New York City",NA
"3217460","sf l",1,3217460,"New York_New York City",NA
"793662","community agency",6,793662,"New York_New York City",NA
"72915","administrative objections",1,72915,"New York_New York City",NA
"1668792","how can a tenant check on the status of their emergency transfer request",1,1668792,"New York_New York City",NA
"1983007","j p herbst police department d",7,1983007,"New York_New York City",NA
"1731327","iii ib",1,1731327,"New York_New York City",NA
"1406948","for any hazardous conditions please first call or",1,1406948,"New York_New York City",NA
"3556201","the full range of costs and benefits and take into",4,3556201,"New York_New York City",NA
"1867844","intervals shall not apply to zoning lots square feet or",2,1867844,"New York_New York City",NA
"2190664","managing iftikhar i ahmad owner iftikhar i ahmad",5,2190664,"New York_New York City",NA
"3955780","w g hoffmann administration for childre a",5,3955780,"New York_New York City",NA
"3179057","section special floor area provisions for qualifying sites for the purposes of applying",1,3179057,"New York_New York City",NA
"857265","content and sound planning policy it supplements but does not supplant the rules for the",1,857265,"New York_New York City",NA
"1267314","e ross police department d",6,1267314,"New York_New York City",NA
"3986554","who are from breezy point please raise your hands",1,3986554,"New York_New York City",NA
"2400529","network a community based",1,2400529,"New York_New York City",NA
"3122548","r s seepaul department of sanitation k",1,3122548,"New York_New York City",NA
"1529662","geo right poldist",3,1529662,"New York_New York City",NA
"3156899","scheduling new regulations were implemented that require vehicle owners to move their",1,3156899,"New York_New York City",NA
"2206716","manual alarm red button",1,2206716,"New York_New York City",NA
"3751187","to result in significant adverse direct and indirect business institutional displacement",1,3751187,"New York_New York City",NA
"760487","c m kearney transit authority",4,760487,"New York_New York City",NA
"1158270","east harlem corridors district and",2,1158270,"New York_New York City",NA
"389741","ask when and how do you usually interact with your",1,389741,"New York_New York City",NA
"863873","contractors continue to comply with current instructions identifying requirements",1,863873,"New York_New York City",NA
"4010169","within existing buildings",4,4010169,"New York_New York City",NA
"1216071","emergency management agency fema flood insurance rate map firm zones according to the",2,1216071,"New York_New York City",NA
"2979548","records reduces identity theft or improves public safety and privacy on the contrary",1,2979548,"New York_New York City",NA
"3224585","shall not be permitted in the underlying district",2,3224585,"New York_New York City",NA
"432651","at the time of certification under the cpc modifications there was no minimum dimensional requirement",1,432651,"New York_New York City",NA
"983334","deliveries",12,983334,"New York_New York City",NA
"1110358","dose at weeks dose series at and catch up series routine tdap dose at",1,1110358,"New York_New York City",NA
"414760","as with each technical area assessed under ceqr it is important for applicants to work closely with the lead agency",6,414760,"New York_New York City",NA
"483937","bbl henley road",11,483937,"New York_New York City",NA
"4068183","y la humedad dentro de las paredes que recurrencia de moho",1,4068183,"New York_New York City",NA
"5212713","with youth gang prevention and social justice however as noted above with the exception of the na",1,5212713,"Washington_Seattle",NA
"724599","b up to wide by long with grating providing open area over the entire",1,724599,"Washington_Seattle",NA
"4785860","to larger mains the remaining costs are shared between two rates based on the number of units or",1,4785860,"Washington_Seattle",NA
"3046582","of this code two units horizontal to one unit vertical percent slope shall",3,3046582,"Washington_Seattle",NA
"2090514","if a child has reached the age at which he or she would otherwise cease to",1,2090514,"Washington_Seattle",NA
"2377850","iwcb n a",2,2377850,"Washington_Seattle",NA
"3734873","resolution to formally close the period over which any scers uaal will be",2,3734873,"Washington_Seattle",NA
"436145","a share of the delays along the s atlantic street and s royal brougham way corridors as well",2,436145,"Washington_Seattle",NA
"1793752","for the soil pipe interface adjusting soil resistivity is usually neither possible nor practical",2,1793752,"Washington_Seattle",NA
"3598934","rbor a",2,3598934,"Washington_Seattle",NA
"1675529","festival is the festival welcomes documentary films of",1,1675529,"Washington_Seattle",NA
"4396026","the atmospheric sciences geophysics building was built in for both the",1,4396026,"Washington_Seattle",NA
"1137491","creating sheets",3,1137491,"Washington_Seattle",NA
"2632369","marine related",4,2632369,"Washington_Seattle",NA
"1459316","electric service engineering shall be responsible for",2,1459316,"Washington_Seattle",NA
"1015117","conditions and three climate change models",1,1015117,"Washington_Seattle",NA
"5025384","vitta utilized the tables and chairs provided",1,5025384,"Washington_Seattle",NA
"1700776","final eis chapter and section",2,1700776,"Washington_Seattle",NA
"2529321","lionel andrew he is co chair of the memory walk a fundraiser which held its most successful yearly",1,2529321,"Washington_Seattle",NA
"147981","aligned on the spacer along the axis of insertion of water main into casing pipe runner length shall approximate the width of",1,147981,"Washington_Seattle",NA
"2894099","n gi",1,2894099,"Washington_Seattle",NA
"3405722","predictable schedules that work",1,3405722,"Washington_Seattle",NA
"3152096","o the addition of a roll up door and single door on the north facade and hanging planters",1,3152096,"Washington_Seattle",NA
"1701894","finally some wallingforders have indicated a desire to see that the industrial business center along",1,1701894,"Washington_Seattle",NA
"4710798","this strategic plan is intended to meet the vision of the citywide emergency management effort through",1,4710798,"Washington_Seattle",NA
"3310652","phenomenon of sand boils on a small scale",1,3310652,"Washington_Seattle",NA
"1601280","exhibits on travel times",1,1601280,"Washington_Seattle",NA
"2052209","housing to select locations for projects funded by fees",3,2052209,"Washington_Seattle",NA
"848337","chester morse lake are nearing the end of their useful lives these pumps are designed for drought situations to access so",30,848337,"Washington_Seattle",NA
"4559801","the permitting pipeline or under construction as of as a result there is an associated",4,4559801,"Washington_Seattle",NA
"5038480","walkshed analysis is based on a half mile boundary commissioner cutler asked if the streetcar lines are",1,5038480,"Washington_Seattle",NA
"2979655","occupant gates",3,2979655,"Washington_Seattle",NA
"1742121","follow as soon as possible but be done in",2,1742121,"Washington_Seattle",NA
"5268521","you have a full understanding and acceptance of what is involved if you participate in the study",2,5268521,"Washington_Seattle",NA
"1241352","department of planning and development with greenwood phinney ridge community reporting area level",27,1241352,"Washington_Seattle",NA
"3238830","participating in if it were offered",1,3238830,"Washington_Seattle",NA
"571875","beach naturalist program the beach naturalist program is in full swing the naturalists have reported",1,571875,"Washington_Seattle",NA
"2574649","lowrise lowrise midrise mr and highrise hr",1,2574649,"Washington_Seattle",NA
"525711","a very abbreviated re cap of their statements follow",1,525711,"Washington_Seattle",NA
"851987","chimneys plumbing vents streets alleys parking lots and through only the following definitions apply",3,851987,"Washington_Seattle",NA
"1496013","encourage membership in local business association h",2,1496013,"Washington_Seattle",NA
"3086580","on the bicycle master plan goal of tripling",1,3086580,"Washington_Seattle",NA
"3868095","seattle additionally the displacement risk maps are flawed and inaccurate",3,3868095,"Washington_Seattle",NA
"875009","city light would construct the city light would relocate the city light would not locate the",1,875009,"Washington_Seattle",NA
"4580489","the publication of the document as noted below some of the conditions imposed are not",1,4580489,"Washington_Seattle",NA
"3745800","responsibilities of the garden everyone has something to offer sandy pernitz p patch",1,3745800,"Washington_Seattle",NA
"4019769","significance four corners an open sky bridge extends from the south",1,4019769,"Washington_Seattle",NA
"777544","capital assets net of depreciation for governmental activities increased by million in major increases",7,777544,"Washington_Seattle",NA
"1892829","give law enforcement the authority to detain a person who is violating their conditions of",1,1892829,"Washington_Seattle",NA
"3559497","pursue a variety of small scale sportsfield improvement or major",1,3559497,"Washington_Seattle",NA
"2769129","more than of residents in single family there for utility programs to target",1,2769129,"Washington_Seattle",NA
"1849187","funds and programs to",1,1849187,"Washington_Seattle",NA
"1271538","despite unanticipated cost and revenue pressures we held",1,1271538,"Washington_Seattle",NA
"307625","and what is this plan requesting from the committee consistent with the city of updated right of way",1,307625,"Washington_Seattle",NA
