"","linesRemove","Freq","ind","city","class"
"1250863","derogatory language to excessive use of force",1,1250863,"Washington_Seattle",NA
"4705291","this project with a great deal of professionalism passion and a vision not only to build a",1,4705291,"Washington_Seattle",NA
"4291629","system availability and kpi thresholds were not met and",2,4291629,"Washington_Seattle",NA
"3951655","services for youth",3,3951655,"Washington_Seattle",NA
"818922","certain covered expenses do not apply toward the payment limit see list below",8,818922,"Washington_Seattle",NA
"659434","bob anderson community package discussion of public benefits susie levy",1,659434,"Washington_Seattle",NA
"5152768","while periodic aeration will help it can be dangerous to run aeration equipment on slopes in the long",1,5152768,"Washington_Seattle",NA
"2305547","in the city of seattle approved a comprehensive set of amendments the",2,2305547,"Washington_Seattle",NA
"2452966","landmark in major stockholder c d stimson commissioned reamer to design the",1,2452966,"Washington_Seattle",NA
"873828","city light joined the washington public power supply system wppss",1,873828,"Washington_Seattle",NA
"3092193","on union hiring halls but do not prohibit non union contractors and workers from participating on",2,3092193,"Washington_Seattle",NA
"1431434","economic recession",1,1431434,"Washington_Seattle",NA
"1216378","defined liquid table",3,1216378,"Washington_Seattle",NA
"3653980","regard to the seattle king county work force development council additional information on the existing joint",2,3653980,"Washington_Seattle",NA
"1495262","encouraged only in single family or zoning areas",2,1495262,"Washington_Seattle",NA
"4284062","swedish medical center first hill campus major institution master plan the feis includes a complete shadow analysis at pp the analysis depends on",1,4284062,"Washington_Seattle",NA
"496478","at tributary area span length multiplied by",3,496478,"Washington_Seattle",NA
"4345551","term rental businesses to raise general revenue for the city taxing short term rentals was a",1,4345551,"Washington_Seattle",NA
"2259542","in seattle increase its work in aeronautical sciences in support of the war host a student",1,2259542,"Washington_Seattle",NA
"3995895","shopping on their way home from work or while",1,3995895,"Washington_Seattle",NA
"3501610","proposed comprehensive plan industrial lands policy amendments and further understand",1,3501610,"Washington_Seattle",NA
"2349933","isolate the impact of the minimum wage from all the other regional trends seen over the same",1,2349933,"Washington_Seattle",NA
"3315321","physical conditions to which most aquatic organisms have adapted examples of these",1,3315321,"Washington_Seattle",NA
"2461","a application of",2,2461,"Washington_Seattle",NA
"1148427","cross section feet in total width including exterior barriers includes two foot lanes two",2,1148427,"Washington_Seattle",NA
"3726207","residential customers in thousands",1,3726207,"Washington_Seattle",NA
"1137447","creating potential hazards for pedestrians",1,1137447,"Washington_Seattle",NA
"4302743","table equity model strengths and weaknesses",3,4302743,"Washington_Seattle",NA
"1626949","expresses concern about a hotel being the iconic structure on the waterfront",1,1626949,"Washington_Seattle",NA
"3635651","redevelopment opportunity at the gateway to west seattle in combination with the future",1,3635651,"Washington_Seattle",NA
"4930481","unlawful in the following cases whenever necessarily used by a public officer in the",1,4930481,"Washington_Seattle",NA
"612052","be parked at ioadirrg docks fnr en d periods",1,612052,"Washington_Seattle",NA
"675097","boyer avenue e protected bicycle lane",1,675097,"Washington_Seattle",NA
"3585329","rainier bellcii",1,3585329,"Washington_Seattle",NA
"2267572","installation of exterior security lighting",1,2267572,"Washington_Seattle",NA
"4410934","the case be referred to the seattle law department office for a final",1,4410934,"Washington_Seattle",NA
"5135358","where do i file my claim",2,5135358,"Washington_Seattle",NA
"372630","approved location and shall initiate an audible or of the door into the sauna room",2,372630,"Washington_Seattle",NA
"2430583","king street station planning hub area and bike station recommendations",1,2430583,"Washington_Seattle",NA
"3708820","required the contractor must notify the engineer working days before start of pruning and provide the name of the",2,3708820,"Washington_Seattle",NA
"459596","as small scale property owners expanded technical",1,459596,"Washington_Seattle",NA
"5249041","xe tra",1,5249041,"Washington_Seattle",NA
"1337968","dissolved oxygen and temperature conditions are good samples collected between",1,1337968,"Washington_Seattle",NA
"261877","and million in and for police relief and pension million in and million in",3,261877,"Washington_Seattle",NA
"3628146","records the law department has utilized outside vendors to handle some of this workload at a cost of about",4,3628146,"Washington_Seattle",NA
"4159964","state of washington assessed tax as measured for each tax using a four year trailing",1,4159964,"Washington_Seattle",NA
